source,crawl_date,country,category,section,title,content_preview,url,trust_score,priority,tags,comments_count,score,chunk_id
webber,2026-06-16,usa,eb2_niw,case_timeline,Episode 34: Overview of U.S. Immigration Law Options for Physicians and Researchers,"Issues that Relate to Everyone: a.  Temporary Visas. b.  Strategies for U.S. Permanent Residence. Physicians: a.  Temporary Visas:  J-1 clinical, J-1 research, H-1B, O-1. b.  Strategies for U.S. Perma",https://webberimmigration.substack.com/p/episode-34-overview-of-us-immigration,0.85,1,,0,,a2690d018c4d52f966fd0cf8a0100ae1
webber,2026-06-16,usa,eb2_niw,case_timeline,Episode 33: Practical Consideration of I-485 Adjustment of Status Discretionary Factors,This is a premium episode for paid subscribers.  In this episode I will go through the USCIS policy manual and the official discretionary factors potentially used in I-485 adjustment of status adjudic,https://webberimmigration.substack.com/p/episode-33-practical-consideration,0.85,1,,0,,d8f93022bea588b78dd9079877b2e670
webber,2026-06-16,usa,eb2_niw,case_timeline,"May 22, 2026: US Department of State says EB-2 India Green Cards are Used Up for FY2026","The US Department of State announced on May 22, 2026, that the US government had issued all the EB-2 immigrant visas (green cards) available for Indians for the rest of the fiscal year, which ends on ",https://webberimmigration.substack.com/p/may-22-2026-us-department-of-state,0.85,1,,0,,f7c3d25ac408f8279a37570ccd45d33f
webber,2026-06-16,usa,eb2_niw,case_timeline,Episode 32: Adjustment of Status versus Immigrant Visa Processing: The Role of Temporary Intent,"May 21, 2026, Policy Memo on Adjustment of Status as Administrative Grace (PM-602-0199):   Here “Failure to depart” as a negative discretionary factor. August 15, 2025, Policy Memo on Good Moral Chara",https://webberimmigration.substack.com/p/episode-32-adjustment-of-status-versus,0.85,1,,0,,0e37072b93d6a10837e7d03c64af04d1
webber,2026-06-16,usa,eb2_niw,case_timeline,"Episode 31: Felonious Gru, USCIS Pause Policies, and Anticipating the Oct 2026 Visa Bulletin",Felonious Gru and the Freeze Ray. USCIS Pause Policies: 39 Countries full pause. 75 Countries - immigrant visa processing pause. Visa Bulletin Cut-Off Dates. Fiscal year starts October 1. Two Charts: ,https://webberimmigration.substack.com/p/episode-31-felonious-gru-uscis-pause,0.85,1,,0,,02e6a57f876449cb0fd2979d57728011
webber,2026-06-16,usa,eb2_niw,case_timeline,Episode 30: U.S. Immigration Law Update (May 2026),U.S. Citizens:  Passport cards and I-130s. Green Card Holders:  Copies of green cards and re-entry permits. People in the United States on Temporary Visas: Caution in international travel. Visa proces,https://webberimmigration.substack.com/p/episode-30-us-immigration-law-update,0.85,1,,0,,a8127e661de630410fbbee666af88e29
webber,2026-06-16,usa,eb2_niw,case_timeline,Episode 28: Into the Weeds on Visa Bulletin Chart B Movement,"After October 2025 Visa Bulletin is issued, no movement on cut-off dates for Chart B for November 2025 Visa Bulletin, then December 2025 Visa Bulletin.   Will dates move forward in January, or will US",https://webberimmigration.substack.com/p/episode-28-into-the-weeds-on-visa,0.85,1,,0,,35f5dd480bfbe31b817bd2757832ed74
webber,2026-06-16,usa,eb2_niw,case_timeline,Episode 27: December 2025 Visa Bulletin released,[EDIT:  This podcast episode has erroneously information on the November 2025 EB-3 cut-off date.  I realized the error after completing the podcast.  The date for December 2025 EB-3 India is correct. ,https://webberimmigration.substack.com/p/episode-27-december-2025-visa-bulletin,0.85,1,,0,,7bb35233ebba74d731a2be4cf46edf55
webber,2026-06-16,usa,eb2_niw,case_timeline,Episode 26: The current state of EB-2 NIW (Nov 2025),"The Basics:  EB-2 + NIW. Matter of NYSDOT. Matter of DHANASAR (December 2016). Biden “force multiplier” memos (January 2021). Pigs get fat, hogs get slaughtered. The role of the H-1B cap lottery. The ",https://webberimmigration.substack.com/p/episode-26-the-current-state-of-eb,0.85,1,,0,,16a673b0c13368e61468baf4fe389b7f
webber,2026-06-16,usa,eb2_niw,case_timeline,Episode 25: Job Changes during the Immigration Process,Job changes for people on temporary visas versus permanent resident (green card processing). Job changes and priority date retention (I-140 approved) but no I-485 pending. Job changes after I-485 file,https://webberimmigration.substack.com/p/episode-25-job-changes-during-the,0.85,1,,0,,f0420c0dc2660ba26297b9b04a49c6ab
webber,2026-06-16,usa,eb2_niw,case_timeline,Episode 24: An Overview on Family-Based (FB) Immigration,"EB immigration (I-140) versus FB immigration (I-130) EB immigration has EB-1 and EB-2 and EB-3 versus FB immigration has F-1, F-2A, F-2B, F-3, F-4, but importantly FB immigration has “immediate relati",https://webberimmigration.substack.com/p/episode-24-an-overview-on-family,0.85,1,,0,,df13a07c003fdde55e23bfb98d13978d
webber,2026-06-16,usa,eb2_niw,case_timeline,Thank you!,"Hi Substack Subscribers - This is just a short post in appreciation of you all, including clients and colleagues (past and present) who have supported our firm. This month (August 2025), our firm was ",https://webberimmigration.substack.com/p/thank-you,0.85,1,,0,,27577754d13c2ca7f62a69244c9f5c30
webber,2026-06-16,usa,eb2_niw,case_timeline,Episode 22A: Visa Bulletin Analysis and Life Planning after Aug 2025 Visa Bulletin,The August 2025 Visa Bulletin has been released.  You can find it  here . I have made a comparison chart from the July 2025 Visa Bulletin: The End Notes from the August 2025 Visa Bulletin: Overview of,https://webberimmigration.substack.com/p/episode-22a-visa-bulletin-analysis,0.85,1,,0,,9a0eab77d5e64f1b4b8697e55f7b3fb4
webber,2026-06-16,usa,eb2_niw,case_timeline,Episode 21: EB Immigration Mid-Year Assessment,"This podcast episode builds on an article I wrote with my colleague and law partner, Tom Oja, which can be found  here . This podcast episode provides an overview on certain topics, so people with adv",https://webberimmigration.substack.com/p/episode-21-eb-immigration-mid-year,0.85,1,,0,,c16157aa0a2205df0a61e1848c17d381
webber,2026-06-16,usa,eb2_niw,case_timeline,Episode 20: International Travel Tips for Summer 2025,I.  U.S. Citizens: Valid U.S. Passports; Registering with the U.S. Department of State while abroad:   STEP II.  Green Card Holders (Legal Permanent Residents): Time spent abroad. Taxes. Political act,https://webberimmigration.substack.com/p/episode-20-international-travel-tips,0.85,1,,0,,fb4fd62fc0e9a663e752eafdc04a3c7c
webber,2026-06-16,usa,eb2_niw,case_timeline,Episode 19: Analysis of the June 2025 Visa Bulletin,The June 2025 Visa Bulletin saw forward movement on EB-2 RoW (Rest of World) that was not expected- This episode will analyze the significance of this movement.  Topics to be discussed - What is the V,https://webberimmigration.substack.com/p/episode-19-analysis-of-the-june-2025,0.85,1,,0,,b534283249bd6653afa41bc118036a53
myimmitracker,2026-06-16,canada,general,tracker_listing,MyImmiTracker: Canadian Citizenship Processing Tracker,MyImmiTracker Canada: Canadian Citizenship Processing Tracker. Category: Immigration. This tracker has 2965 cases tracked by community members. Last updated 33 minutes ago. Tracker URL: https://myimmi,https://myimmitracker.com/en/ca/trackers/canadian-citizenship-processing-tracker,0.7,2,immitracker|canada|processing_time|tracker,0,,e43b6d8afbeee79fa41d0dd95d5e2299
myimmitracker,2026-06-16,canada,express_entry,tracker_listing,MyImmiTracker: Consolidated Express Entry PR Application Tracker,MyImmiTracker Canada: Consolidated Express Entry PR Application Tracker. Category: Permanent Skilled Streams. This tracker has 21462 cases tracked by community members. Last updated about 2 hours ago.,https://myimmitracker.com/en/ca/trackers/consolidated-express-entry-pr-application-tracker,0.7,2,immitracker|canada|permanent skilled streams|processing_time|tracker,0,,62c21b7b4ebbd90181c377d986993606
myimmitracker,2026-06-16,canada,express_entry,tracker_listing,MyImmiTracker: CEC Express Entry Tracker,MyImmiTracker Canada: CEC Express Entry Tracker (subtracker). Category: Permanent Skilled Streams. This tracker has 6889 cases tracked by community members. Last updated about 2 hours ago. Tracker URL,https://myimmitracker.com/en/ca/trackers/cec-express-entry-tracker,0.7,2,immitracker|canada|permanent skilled streams|processing_time|tracker,0,,0637d57cf924aabe04d35817ff09c798
myimmitracker,2026-06-16,canada,general,tracker_listing,MyImmiTracker: 2025 Express Entry PR Application Tracker,MyImmiTracker Canada: 2025 Express Entry PR Application Tracker (subtracker). Category: Immigration. This tracker has 701 cases tracked by community members. Last updated about 2 hours ago. Tracker UR,https://myimmitracker.com/en/ca/trackers/2025-express-entry-pr-application-tracker,0.7,2,immitracker|canada|processing_time|tracker,0,,3d94dbe984d6ab9a94c080da0390e1e0
myimmitracker,2026-06-16,canada,general,tracker_listing,MyImmiTracker: Consolidated Spousal Sponsorship Tracker,MyImmiTracker Canada: Consolidated Spousal Sponsorship Tracker. Category: Family Sponsored. This tracker has 2395 cases tracked by community members. Last updated about 2 hours ago. Tracker URL: https,https://myimmitracker.com/en/ca/trackers/consolidated-spousal-sponsorship-tracker,0.7,2,immitracker|canada|family sponsored|processing_time|tracker,0,,506cb229fd9e98f476e71daf7cc25d4f
myimmitracker,2026-06-16,canada,general,tracker_listing,MyImmiTracker: Outland Spousal Sponsorship Tracker,MyImmiTracker Canada: Outland Spousal Sponsorship Tracker (subtracker). Category: Family Sponsored. This tracker has 1756 cases tracked by community members. Last updated about 2 hours ago. Tracker UR,https://myimmitracker.com/en/ca/trackers/outland-spousal-sponsorship-tracker,0.7,2,immitracker|canada|family sponsored|processing_time|tracker,0,,7e1f16ba6b6180a4b938e545f430de72
myimmitracker,2026-06-16,canada,express_entry,tracker_listing,MyImmiTracker: Indian Nationals Express Entry Tracker,MyImmiTracker Canada: Indian Nationals Express Entry Tracker (subtracker). Category: Permanent Skilled Streams. This tracker has 10381 cases tracked by community members. Last updated about 2 hours ag,https://myimmitracker.com/en/ca/trackers/indian-nationals-express-entry-tracker,0.7,2,immitracker|canada|permanent skilled streams|processing_time|tracker,0,,dd1e91076d0297a91fe4b6b8c4ff1120
myimmitracker,2026-06-16,canada,general,tracker_listing,MyImmiTracker: Inland Spousal Sponsorship Tracker,MyImmiTracker Canada: Inland Spousal Sponsorship Tracker (subtracker). Category: Family Sponsored. This tracker has 640 cases tracked by community members. Last updated about 2 hours ago. Tracker URL:,https://myimmitracker.com/en/ca/trackers/inland-spousal-sponsorship-tracker,0.7,2,immitracker|canada|family sponsored|processing_time|tracker,0,,a11bfbcd16971708747ca39400494cbb
myimmitracker,2026-06-16,canada,express_entry,tracker_listing,MyImmiTracker: Ukrainian Nationals Express Entry Tracker,MyImmiTracker Canada: Ukrainian Nationals Express Entry Tracker (subtracker). Category: Permanent Skilled Streams. This tracker has 226 cases tracked by community members. Last updated about 3 hours a,https://myimmitracker.com/en/ca/trackers/ukrainian-nationals-express-entry-tracker,0.7,2,immitracker|canada|permanent skilled streams|processing_time|tracker,0,,f93c6b149ba07bb5e9cfab834a0d53e8
myimmitracker,2026-06-16,canada,express_entry,tracker_listing,MyImmiTracker: Russian Nationals Express Entry Tracker,MyImmiTracker Canada: Russian Nationals Express Entry Tracker (subtracker). Category: Permanent Skilled Streams. This tracker has 359 cases tracked by community members. Last updated about 4 hours ago,https://myimmitracker.com/en/ca/trackers/russian-nationals-express-entry-tracker,0.7,2,immitracker|canada|permanent skilled streams|processing_time|tracker,0,,a8d0b0e7ca2203a56a85b3bf72fe2359
myimmitracker,2026-06-16,canada,express_entry,tracker_listing,MyImmiTracker: Chinese Nationals Express Entry Tracker,MyImmiTracker Canada: Chinese Nationals Express Entry Tracker (subtracker). Category: Permanent Skilled Streams. This tracker has 1837 cases tracked by community members. Last updated about 8 hours ag,https://myimmitracker.com/en/ca/trackers/chinese-nationals-express-entry-tracker,0.7,2,immitracker|canada|permanent skilled streams|processing_time|tracker,0,,8f7af56744fec71edf0c5b8456e183c5
myimmitracker,2026-06-16,canada,express_entry,tracker_listing,MyImmiTracker: PNP Inland Express Entry Tracker,MyImmiTracker Canada: PNP Inland Express Entry Tracker (subtracker). Category: Permanent Skilled Streams. This tracker has 1742 cases tracked by community members. Last updated about 10 hours ago. Tra,https://myimmitracker.com/en/ca/trackers/pnp-inland-express-entry-tracker,0.7,2,immitracker|canada|permanent skilled streams|processing_time|tracker,0,,ac33b26e780b939a0fd02a22d494c341
myimmitracker,2026-06-16,canada,general,tracker_listing,MyImmiTracker: PNP Express Entry Tracker,MyImmiTracker Canada: PNP Express Entry Tracker (subtracker). Category: Immigration. This tracker has 4927 cases tracked by community members. Last updated about 10 hours ago. Tracker URL: https://myi,https://myimmitracker.com/en/ca/trackers/pnp-express-entry-tracker,0.7,2,immitracker|canada|processing_time|tracker,0,,c18b9f728c730d7d51d4434b1432f62d
myimmitracker,2026-06-16,canada,express_entry,tracker_listing,MyImmiTracker: PNP Non-Express Entry Tracker,MyImmiTracker Canada: PNP Non-Express Entry Tracker. Category: Permanent Skilled Streams. This tracker has 290 cases tracked by community members. Last updated about 10 hours ago. Tracker URL: https:/,https://myimmitracker.com/en/ca/trackers/pnp-non-express-entry-tracker,0.7,2,immitracker|canada|permanent skilled streams|processing_time|tracker,0,,754f84ee3aec2cd8eed2ccd3875ed19b
myimmitracker,2026-06-16,canada,express_entry,tracker_listing,MyImmiTracker: FSW Outland Express Entry Tracker,MyImmiTracker Canada: FSW Outland Express Entry Tracker (subtracker). Category: Permanent Skilled Streams. This tracker has 8738 cases tracked by community members. Last updated about 12 hours ago. Tr,https://myimmitracker.com/en/ca/trackers/fsw-outland-express-entry-tracker,0.7,2,immitracker|canada|permanent skilled streams|processing_time|tracker,0,,055f256285d054b5541a0866ca86eebf
myimmitracker,2026-06-16,canada,general,tracker_listing,MyImmiTracker: Federal Skilled Worker (FSW) Express Entry Tracker,MyImmiTracker Canada: Federal Skilled Worker (FSW) Express Entry Tracker (subtracker). Category: Immigration. This tracker has 9647 cases tracked by community members. Last updated about 12 hours ago.,https://myimmitracker.com/en/ca/trackers/federal-skilled-worker-fsw-express-entry-tracker,0.7,2,immitracker|canada|processing_time|tracker,0,,e394e23084045db44a657da3936e6fae
myimmitracker,2026-06-16,canada,express_entry,tracker_listing,MyImmiTracker: USA Nationals Express Entry Tracker,MyImmiTracker Canada: USA Nationals Express Entry Tracker (subtracker). Category: Permanent Skilled Streams. This tracker has 134 cases tracked by community members. Last updated about 12 hours ago. T,https://myimmitracker.com/en/ca/trackers/usa-nationals-express-entry-tracker,0.7,2,immitracker|canada|permanent skilled streams|processing_time|tracker,0,,e566faedd9b6a99d4419616da4b4bef0
myimmitracker,2026-06-16,canada,express_entry,tracker_listing,MyImmiTracker: PNP Outland Express Entry Tracker,MyImmiTracker Canada: PNP Outland Express Entry Tracker (subtracker). Category: Permanent Skilled Streams. This tracker has 3185 cases tracked by community members. Last updated 1 day ago. Tracker URL,https://myimmitracker.com/en/ca/trackers/pnp-outland-express-entry-tracker,0.7,2,immitracker|canada|permanent skilled streams|processing_time|tracker,0,,3b17c45091d1b8ac689f5f336027e760
myimmitracker,2026-06-16,canada,general,tracker_listing,MyImmiTracker: 2024 Express Entry PR Application Tracker,MyImmiTracker Canada: 2024 Express Entry PR Application Tracker (subtracker). Category: Immigration. This tracker has 1727 cases tracked by community members. Last updated 1 day ago. Tracker URL: http,https://myimmitracker.com/en/ca/trackers/2024-express-entry-pr-application-tracker,0.7,2,immitracker|canada|processing_time|tracker,0,,2861164153846e0678b11508ae7274e8
myimmitracker,2026-06-16,canada,general,tracker_listing,MyImmiTracker: Mississauga VO Spouse Sponsorship Applicants,MyImmiTracker Canada: Mississauga VO Spouse Sponsorship Applicants (subtracker). Category: Family Sponsored. This tracker has 525 cases tracked by community members. Last updated 2 days ago. Tracker U,https://myimmitracker.com/en/ca/trackers/mississauga-vo-spouse-sponsorship-applicants,0.7,2,immitracker|canada|family sponsored|processing_time|tracker,0,,c69525f8e0633a6554bfc151f65c50cd
travel.state.gov,2026-06-16,usa,general,earlier,US Visa Bulletin June 2026 — earlier,US Visa Bulletin June 2026 — earlier: Family- Sponsored: F1 | All Chargeability Areas Except Those Listed: 01SEP17 | CHINA-mainland born: 01SEP17 | INDIA: 01SEP17 | MEXICO: 08NOV07 | PHILIPPINES: 01MA,https://travel.state.gov/content/travel/en/legal/visa-law0/visa-bulletin/2026/visa-bulletin-for-june-2026.html,0.95,1,visa_bulletin|other|priority_dates|uscis|june_2026,0,,45ffc8a3dac6f841203f971afa721d0a
travel.state.gov,2026-06-16,usa,general,earlier,US Visa Bulletin June 2026 — earlier,US Visa Bulletin June 2026 — earlier: Family- Sponsored: F2A | All Chargeability Areas Except Those Listed: 01JAN25 | CHINA-mainland born: 01JAN25 | INDIA: 01JAN25 | MEXICO: 01JAN24 | PHILIPPINES: 01J,https://travel.state.gov/content/travel/en/legal/visa-law0/visa-bulletin/2026/visa-bulletin-for-june-2026.html,0.95,1,visa_bulletin|other|priority_dates|uscis|june_2026,0,,6270612a73b22a877e48e1e49bff442a
travel.state.gov,2026-06-16,usa,general,earlier,US Visa Bulletin June 2026 — earlier,US Visa Bulletin June 2026 — earlier: Family- Sponsored: F2B | All Chargeability Areas Except Those Listed: 22SEP17 | CHINA-mainland born: 22SEP17 | INDIA: 22SEP17 | MEXICO: 15FEB09 | PHILIPPINES: 08A,https://travel.state.gov/content/travel/en/legal/visa-law0/visa-bulletin/2026/visa-bulletin-for-june-2026.html,0.95,1,visa_bulletin|other|priority_dates|uscis|june_2026,0,,03b01716e279e4be5617d605127293f0
travel.state.gov,2026-06-16,usa,general,earlier,US Visa Bulletin June 2026 — earlier,US Visa Bulletin June 2026 — earlier: Family- Sponsored: F3 | All Chargeability Areas Except Those Listed: 15FEB12 | CHINA-mainland born: 15FEB12 | INDIA: 15FEB12 | MEXICO: 01MAY01 | PHILIPPINES: 22NO,https://travel.state.gov/content/travel/en/legal/visa-law0/visa-bulletin/2026/visa-bulletin-for-june-2026.html,0.95,1,visa_bulletin|other|priority_dates|uscis|june_2026,0,,751b2fe4813da6b907b494f66cda035d
travel.state.gov,2026-06-16,usa,general,earlier,US Visa Bulletin June 2026 — earlier,US Visa Bulletin June 2026 — earlier: Family- Sponsored: F4 | All Chargeability Areas Except Those Listed: 08NOV08 | CHINA-mainland born: 08NOV08 | INDIA: 01NOV06 | MEXICO: 08APR01 | PHILIPPINES: 15JU,https://travel.state.gov/content/travel/en/legal/visa-law0/visa-bulletin/2026/visa-bulletin-for-june-2026.html,0.95,1,visa_bulletin|other|priority_dates|uscis|june_2026,0,,785ac9cd1f016474e6bb713c5c40529a
travel.state.gov,2026-06-16,usa,general,earlier,US Visa Bulletin June 2026 — earlier,US Visa Bulletin June 2026 — earlier: Family- Sponsored: F1 | All Chargeability Areas Except Those Listed: 01OCT18 | CHINA- mainland born: 01OCT18 | INDIA: 01OCT18 | MEXICO: 01OCT08 | PHILIPPINES: 22A,https://travel.state.gov/content/travel/en/legal/visa-law0/visa-bulletin/2026/visa-bulletin-for-june-2026.html,0.95,1,visa_bulletin|other|priority_dates|uscis|june_2026,0,,634cffa0245b27dcfd7a427744041bc0
travel.state.gov,2026-06-16,usa,general,earlier,US Visa Bulletin June 2026 — earlier,US Visa Bulletin June 2026 — earlier: Family- Sponsored: F2A | All Chargeability Areas Except Those Listed: C | CHINA- mainland born: C | INDIA: C | MEXICO: C | PHILIPPINES: C. Source: US Department o,https://travel.state.gov/content/travel/en/legal/visa-law0/visa-bulletin/2026/visa-bulletin-for-june-2026.html,0.95,1,visa_bulletin|other|priority_dates|uscis|june_2026,0,,16deade9c8ebb265d38274c80c7341d2
travel.state.gov,2026-06-16,usa,general,earlier,US Visa Bulletin June 2026 — earlier,US Visa Bulletin June 2026 — earlier: Family- Sponsored: F2B | All Chargeability Areas Except Those Listed: 22MAR18 | CHINA- mainland born: 22MAR18 | INDIA: 22MAR18 | MEXICO: 15MAY10 | PHILIPPINES: 01,https://travel.state.gov/content/travel/en/legal/visa-law0/visa-bulletin/2026/visa-bulletin-for-june-2026.html,0.95,1,visa_bulletin|other|priority_dates|uscis|june_2026,0,,2862ee467df5298791112806bc2bdc26
travel.state.gov,2026-06-16,usa,general,earlier,US Visa Bulletin June 2026 — earlier,US Visa Bulletin June 2026 — earlier: Family- Sponsored: F3 | All Chargeability Areas Except Those Listed: 08DEC12 | CHINA- mainland born: 08DEC12 | INDIA: 08DEC12 | MEXICO: 15JUL01 | PHILIPPINES: 08A,https://travel.state.gov/content/travel/en/legal/visa-law0/visa-bulletin/2026/visa-bulletin-for-june-2026.html,0.95,1,visa_bulletin|other|priority_dates|uscis|june_2026,0,,45e4f827ea388ff8422b05b6247f299e
travel.state.gov,2026-06-16,usa,general,earlier,US Visa Bulletin June 2026 — earlier,US Visa Bulletin June 2026 — earlier: Family- Sponsored: F4 | All Chargeability Areas Except Those Listed: 22DEC09 | CHINA- mainland born: 22DEC09 | INDIA: 15DEC06 | MEXICO: 30APR01 | PHILIPPINES: 22M,https://travel.state.gov/content/travel/en/legal/visa-law0/visa-bulletin/2026/visa-bulletin-for-june-2026.html,0.95,1,visa_bulletin|other|priority_dates|uscis|june_2026,0,,1531ce44b69f7e3aad2d1095d4c8b9c8
travel.state.gov,2026-06-16,usa,general,earlier,US Visa Bulletin June 2026 — earlier,US Visa Bulletin June 2026 — earlier: Employment- based: 1st | All Chargeability Areas Except Those Listed: C | CHINA- mainland born: 01APR23 | INDIA: 15DEC22 | MEXICO: C | PHILIPPINES: C. Source: US ,https://travel.state.gov/content/travel/en/legal/visa-law0/visa-bulletin/2026/visa-bulletin-for-june-2026.html,0.95,1,visa_bulletin|other|priority_dates|uscis|june_2026,0,,be784860f21a0f725cd0b709d479e16f
travel.state.gov,2026-06-16,usa,general,earlier,US Visa Bulletin June 2026 — earlier,US Visa Bulletin June 2026 — earlier: Employment- based: 2nd | All Chargeability Areas Except Those Listed: C | CHINA- mainland born: 01SEP21 | INDIA: 01SEP13 | MEXICO: C | PHILIPPINES: C. Source: US ,https://travel.state.gov/content/travel/en/legal/visa-law0/visa-bulletin/2026/visa-bulletin-for-june-2026.html,0.95,1,visa_bulletin|other|priority_dates|uscis|june_2026,0,,0bfbb878b3420eb821958e06f0da0872
travel.state.gov,2026-06-16,usa,general,earlier,US Visa Bulletin June 2026 — earlier,US Visa Bulletin June 2026 — earlier: Employment- based: 3rd | All Chargeability Areas Except Those Listed: 01JUN24 | CHINA- mainland born: 01AUG21 | INDIA: 15DEC13 | MEXICO: 01JUN24 | PHILIPPINES: 01,https://travel.state.gov/content/travel/en/legal/visa-law0/visa-bulletin/2026/visa-bulletin-for-june-2026.html,0.95,1,visa_bulletin|other|priority_dates|uscis|june_2026,0,,831a3238262217d1ef6dac8f1ba80d52
travel.state.gov,2026-06-16,usa,general,earlier,US Visa Bulletin June 2026 — earlier,US Visa Bulletin June 2026 — earlier: Employment- based: Other Workers | All Chargeability Areas Except Those Listed: 01FEB22 | CHINA- mainland born: 01APR19 | INDIA: 15DEC13 | MEXICO: 01FEB22 | PHILI,https://travel.state.gov/content/travel/en/legal/visa-law0/visa-bulletin/2026/visa-bulletin-for-june-2026.html,0.95,1,visa_bulletin|other|priority_dates|uscis|june_2026,0,,56fd2bc68829f821d7f7f26cd6214077
travel.state.gov,2026-06-16,usa,general,earlier,US Visa Bulletin June 2026 — earlier,US Visa Bulletin June 2026 — earlier: Employment- based: 4th | All Chargeability Areas Except Those Listed: 15JUL22 | CHINA- mainland born: 15JUL22 | INDIA: 15JUL22 | MEXICO: 15JUL22 | PHILIPPINES: 15,https://travel.state.gov/content/travel/en/legal/visa-law0/visa-bulletin/2026/visa-bulletin-for-june-2026.html,0.95,1,visa_bulletin|other|priority_dates|uscis|june_2026,0,,36616738335db17ae2a5b8cfc0226986
travel.state.gov,2026-06-16,usa,general,earlier,US Visa Bulletin June 2026 — earlier,US Visa Bulletin June 2026 — earlier: Employment- based: Certain Religious Workers | All Chargeability Areas Except Those Listed: 15JUL22 | CHINA- mainland born: 15JUL22 | INDIA: 15JUL22 | MEXICO: 15J,https://travel.state.gov/content/travel/en/legal/visa-law0/visa-bulletin/2026/visa-bulletin-for-june-2026.html,0.95,1,visa_bulletin|other|priority_dates|uscis|june_2026,0,,6f1f9a3692e2c554a4d689d01a1d92bf
travel.state.gov,2026-06-16,usa,general,earlier,US Visa Bulletin June 2026 — earlier,"US Visa Bulletin June 2026 — earlier: Employment- based: 5th Unreserved (including C5, T5, I5, R5, NU, RU) | All Chargeability Areas Except Those Listed: C | CHINA- mainland born: 22SEP16 | INDIA: 01M",https://travel.state.gov/content/travel/en/legal/visa-law0/visa-bulletin/2026/visa-bulletin-for-june-2026.html,0.95,1,visa_bulletin|other|priority_dates|uscis|june_2026,0,,1e65ec781b46e77ec98a08c89a545bb7
travel.state.gov,2026-06-16,usa,general,earlier,US Visa Bulletin June 2026 — earlier,"US Visa Bulletin June 2026 — earlier: Employment- based: 5th Set Aside: Rural (20%, including NR, RR) | All Chargeability Areas Except Those Listed: C | CHINA- mainland born: C | INDIA: C | MEXICO: C ",https://travel.state.gov/content/travel/en/legal/visa-law0/visa-bulletin/2026/visa-bulletin-for-june-2026.html,0.95,1,visa_bulletin|other|priority_dates|uscis|june_2026,0,,bd83285dd12a2dd1a782bdb06d4eaf30
