source,crawl_date,country,category,section,title,content_preview,url,trust_score,priority,tags,comments_count,score,chunk_id
cicnews,2026-06-16,canada,general,policy_update,Canada asks new citizens to hand back their citizenship certificates,"Recent applicants under Canada’s expanded citizenship laws are facing renewed scrutiny from the government, after their citizenship application has been approved. The most recent amendment to the coun",https://www.cicnews.com/2026/06/canadian-citizenship-under-review-after-approval-the-recent-letter-from-the-government-explained-0676808.html,0.85,1,Citizenship|Canadian citizenship|Canadian citizenship by descent|Canadian citizenship certificate|Canadian citizenship for Americans|Canadian passport|citizenship|how to respond to a surrender letter|Proof of Canadian citizenship certificate|Proof of Citizenship|surrender letters Canadian citizenship by descent|surrender letters Canadian proof of citizenship,0,,cd4bdc055a3e5eec60efe0bb358f98c9
cicnews,2026-06-16,canada,general,policy_update,Canada eases access to work permits for provincial nominees,"Provincial nominees and their spouses can qualify for work permits months sooner, under temporary operational measures put in place by Canada’s immigration department. As of June 2026, eligible foreig",https://www.cicnews.com/2026/06/canada-eases-access-to-work-permits-for-provincial-nominees-0676800.html,0.85,1,Work|Base Provincial Nominee Program|Bridging Open Work Permit|enhanced PNP|provincial nominee program,0,,c999127b9c2734d400d995343c099aa7
cicnews,2026-06-16,canada,general,policy_update,Wait time drops for in-Canada work permit applications and extensions,The wait time for in-Canada work permit applications has dropped by nearly a full month. Foreign nationals in Canada who submit an application for a new work permit or to extend their existing work pe,https://www.cicnews.com/2026/06/wait-time-drops-for-in-canada-work-permit-applications-and-extensions-0676793.html,0.85,1,Work|Applying for a work permit from within Canada|IRCC processing times|latest IRCC processing times|maintained status|work permit extensions|Work permit support letters|work permits,0,,0eba9ed5906cd6137256bd92f2eac54f
cicnews,2026-06-16,canada,general,policy_update,"Lewiston, Maine was built by French Canadians—many of their descendants may now be Canadian too","In the 1870s, the trains pulled into Lewiston’s Grand Trunk Station carrying a new kind of arrival. They came from Quebec farms and Acadian villages in the Maritimes — thousands of French-speaking Can",https://www.cicnews.com/2026/06/lewiston-was-built-by-french-canadians-many-of-their-descendants-may-now-be-canadian-0676779.html,0.85,1,Citizenship|Am I a Canadian citizen|Am I a Canadian citizen by descent|Canadian passport for American citizens|citizenship|Citizenship by Descent|lewiston|Maine|New England,0,,89805fb496b1cad69d84a07d95e5798b
cicnews,2026-06-16,canada,general,policy_update,Newfoundland and Labrador issues 108 invitations to candidates across both provincial immigration programs,"On June 10, Newfoundland and Labrador held its seventh provincial immigration draw, issuing more invitations for provincial immigration. The province extended a total of 108 invitations through the Ne",https://www.cicnews.com/2026/06/newfoundland-and-labrador-issues-108-invitations-to-candidates-across-both-provincial-immigration-programs-0676766.html,0.85,1,Provinces|AIP endorsement|Atlantic Immigration Program|Canadian permanent residence|Immigrating to Newfoundland and Labrador|invitations to apply|Newfoundland and Labrador draws|Newfoundland and Labrador Provincial Nominee Program|NL AIP draws|NLPNP draws|provincial nomination,0,,c286635b2c8d17dc533084d75ac98a77
cicnews,2026-06-16,canada,general,policy_update,Nearly one in six Woonsocket residents may already be Canadian,"In Woonsocket, Rhode Island, the old nickname still holds: la ville la plus française aux États-Unis — the most French city in the United States. A recent change to Canadian law has turned that legacy",https://www.cicnews.com/2026/06/nearly-one-in-six-woonsocket-residents-may-already-be-canadian-0676755.html,0.85,1,Citizenship|A I a Canadian citizen?|Am I eligible for Canadian citizenship?|American-Canadian dual citizenship|Apply for proof of Canadian citizenship|Applying for a proof of Canadian citizenship|Canadian citizenship|Canadian citizenship for American nationals|Canadian citizenship for Rhode Islanders|Rhode Island|RI|Woonsocket,0,,78de7ce4c225312c486d17729d8becfa
cicnews,2026-06-16,canada,general,policy_update,"36,000 permanent residence applications suspended under Ebola measures","Canada has suspended the processing of around 36,000 applications for permanent residence (PR), in quarantine-related measures affecting foreign nationals within the Democratic Republic of the Congo, ",https://www.cicnews.com/2026/06/breaking-36000-permanent-residence-applications-suspended-under-ebola-measures-0676721.html,0.85,1,Canada|Democratic Republic of Congo|Ebola disease outbreak|permanent residence applications|South Sudan|Uganda,0,,bd47cb388151ee187a58c593e84f20dd
cicnews,2026-06-16,canada,general,policy_update,"Roy, King, Mitchell, Desjardins, and more: Why your surname may be the key to Canadian citizenship","For much of the last 300 years, a French-Canadian family could answer to two surnames at once. A man baptized Roy might be buried as a Desjardins. Their grandchildren might use both, or pick one, or q",https://www.cicnews.com/2026/06/roy-king-mitchell-desjardins-and-more-why-your-surname-may-be-the-key-to-canadian-citizenship-0676693.html,0.85,1,Citizenship|Bill C-3|Canadian citizenship|Canadian citizenship for American citizens|Canadian citizenship for Americans|Citizenship by Descent|dit names|how to find your Canadian ancestor|How to find your Canadian ancestry|how to get a Canadian passport as an American|How to get a Canadian passport?,0,,be4750d0986abbf91cb008605af86884
cicnews,2026-06-16,canada,general,policy_update,Manitoba retires student pathway to permanent residence,"The Manitoba Provincial Nominee Program (MPNP) is closing the Career Employment Pathway (CEP) of its International Education Stream, effective immediately. Former CEP candidates wishing to settle in M",https://www.cicnews.com/2026/06/breaking-manitoba-retires-student-pathway-to-permanent-residence-0676707.html,0.85,1,Provinces|Canadian immigration|Immigrating to Manitoba|international student graduates|manitoba provincial nominee program|Manitoba student graduates|MPNP Career Employment Pathway|MPNP International Education Stream|MPNP permanent residence pathway closure|provincial nomination,0,,189b8ab3a4fa49510163fa8b444ba386
cicnews,2026-06-16,canada,general,policy_update,Proposed high-wage factor offers boon to Express Entry candidates in these priority occupations,"Of the occupations currently being prioritized for permanent residence by the Canadian federal government, about four in ten are set to receive a further boost in priority through the proposed high-wa",https://www.cicnews.com/2026/06/proposed-high-wage-factor-offers-boon-to-express-entry-candidates-in-these-priority-occupations-0676571.html,0.85,1,Express Entry|Canadian job offer|Canadian permanent residence|Canadian work experience|Category-based selection|Category-eligible occupations|CBS draws|comprehensive ranking system|CRS points for high wage occupations|ESDC Job Bank|Express Entry reforms|High-wage occupation factor|immigrate through Express Entry,0,,9cf6e286aee52b0721d9ea9639165d2c
moving2canada,2026-06-16,canada,general,policy_update,How to Prepare Your Profile for Express Entry Reforms,![Close](https://moving2canada.com/wp-content/plugins/webtoffee-cookie-consent/lite/frontend/images/close.svg) Cookies keep our resources free for you Clicking ‘Okay’ helps us bring you this content f,https://moving2canada.com/features/how-to-prepare-for-express-entry-reforms-11-june-2026/,0.8,1,Immigration|Express Entry|Express entry,0,,a1fea9b03292825eaf4c08349e25a4b0
moving2canada,2026-06-16,canada,general,policy_update,Canada’s NOC System Wasn’t Built for Immigration. So Why Does Immigration Depend on it?,![Close](https://moving2canada.com/wp-content/plugins/webtoffee-cookie-consent/lite/frontend/images/close.svg) Cookies keep our resources free for you Clicking ‘Okay’ helps us bring you this content f,https://moving2canada.com/features/canada-noc-immigration-needs-06-2026/,0.8,1,Immigration|Express entry|LMIA|PNP,0,,2fe5485ff52d1c8913f1e2faa6709fab
moving2canada,2026-06-16,canada,general,policy_update,"Quebec’s PEQ to Reopen July 2,  Prioritizing Applicants Who Were Eligible When It Closed",![Close](https://moving2canada.com/wp-content/plugins/webtoffee-cookie-consent/lite/frontend/images/close.svg) Cookies keep our resources free for you Clicking ‘Okay’ helps us bring you this content f,https://moving2canada.com/news/quebec-peq-reopen-july-2-2026/,0.8,1,Immigration|PEQ|Quebec,0,,af6627b3723d1c01dee54d98b8ce6261
moving2canada,2026-06-16,canada,general,policy_update,Why Didn’t IRCC Hold an Express Entry Draw Today?,![Close](https://moving2canada.com/wp-content/plugins/webtoffee-cookie-consent/lite/frontend/images/close.svg) Cookies keep our resources free for you Clicking ‘Okay’ helps us bring you this content f,https://moving2canada.com/news/express-entry-draw-june-9-2026/,0.8,1,Express Entry|Immigration|Canadian experience class|Express entry|Express entry draw,0,,4f524e8b854b9355b1a077f4a96311cd
moving2canada,2026-06-16,canada,general,policy_update,Alberta’s Separation Referendum Includes Immigration Questions – Here’s What Newcomers Should Know,![Close](https://moving2canada.com/wp-content/plugins/webtoffee-cookie-consent/lite/frontend/images/close.svg) Cookies keep our resources free for you Clicking ‘Okay’ helps us bring you this content f,https://moving2canada.com/features/alberta-separation-referendum-immigration-questions/,0.8,1,Immigration|PNP|AAIP|Alberta|Immigration to Alberta,0,,a021c016f36914a5c2d63ec34088649c
moving2canada,2026-06-16,canada,general,policy_update,Canada’s AI Strategy Promises to Fast-Track Work Permits for AI Talent,![Close](https://moving2canada.com/wp-content/plugins/webtoffee-cookie-consent/lite/frontend/images/close.svg) Cookies keep our resources free for you Clicking ‘Okay’ helps us bring you this content f,https://moving2canada.com/news/canada-ai-strategy-to-fast-track-work-permits-for-ai-professionals/,0.8,1,Work|Work Permits,0,,cea1828491c5c27b2d7ab4570c9c378e
moving2canada,2026-06-16,canada,general,policy_update,Canada Extends Work Permits to Spouses of Eligible Quebec Skilled Workers,![Close](https://moving2canada.com/wp-content/plugins/webtoffee-cookie-consent/lite/frontend/images/close.svg) Cookies keep our resources free for you Clicking ‘Okay’ helps us bring you this content f,https://moving2canada.com/news/canada-extends-work-permits-to-quebec-skilled-workers-spouses-05-06-2026/,0.8,1,Immigration,0,,d54a9510606d8d2994f5885ccedbeaff
moving2canada,2026-06-16,canada,general,policy_update,IEC Age Limit and Work Permit Validity: What You Need to Know,![Close](https://moving2canada.com/wp-content/plugins/webtoffee-cookie-consent/lite/frontend/images/close.svg) Cookies keep our resources free for you Clicking ‘Okay’ helps us bring you this content f,https://moving2canada.com/features/iec-age-limit-work-permit-validity/,0.8,1,Immigration|IEC,0,,dbc69da259dcdd5c28f2440f793d4a51
moving2canada,2026-06-16,canada,general,policy_update,Next BoC Interest Rate Decision on June 10 as Canada Enters Technical Recession,![Close](https://moving2canada.com/wp-content/plugins/webtoffee-cookie-consent/lite/frontend/images/close.svg) Cookies keep our resources free for you Clicking ‘Okay’ helps us bring you this content f,https://moving2canada.com/news/bank-of-canada-interest-rate-decision-on-june-10-technical-recession-06-2026/,0.8,1,Living|Finances,0,,c9037bc553b6118d5dabd8dafd4b56c1
moving2canada,2026-06-16,canada,general,policy_update,IRCC Updates Program Instructions for AIP Applicants Whose Jobs Situation Changes,![Close](https://moving2canada.com/wp-content/plugins/webtoffee-cookie-consent/lite/frontend/images/close.svg) Cookies keep our resources free for you Clicking ‘Okay’ helps us bring you this content f,https://moving2canada.com/news/aip-program-instructions-update-job-situation-06-2026/,0.8,1,Immigration,0,,23cd90c30b8f02d6e8de740bf4d20f38
reddit_CanadaVisa,2026-06-16,canada,general,q_and_a,"IRCC Non-Compliant Employers — April 2026 Update: 32 new employers added, $1.7M in fines, 4 employment bans issued","IRCC Non-Compliant Employers — April 2026 Update: 32 new employers added, $1.7M in fines, 4 employment bans issued",https://reddit.com/r/CanadaVisa/comments/1t2tmz1/ircc_noncompliant_employers_april_2026_update_32/,0.5,2,CanadaVisa,0,0,dde6f2aac217b339f51ec320a7fbb4f0
reddit_CanadaVisa,2026-06-16,canada,general,q_and_a,Canada Visitor Visa Refusals in 2026 — The Real Reasons Officers Are Saying No (And What to Do About It),Canada Visitor Visa Refusals in 2026 — The Real Reasons Officers Are Saying No (And What to Do About It),https://reddit.com/r/CanadaVisa/comments/1t2lbof/canada_visitor_visa_refusals_in_2026_the_real/,0.5,2,CanadaVisa,0,0,39ad7cd802268a9d291f0c25d5fcbd0f
reddit_CanadaVisa,2026-06-16,canada,general,q_and_a,"Citizenship application is In progress since February 3rd 2026. Location: Ottawa. Last update on tracker was for Language, Prohibition and Physical presence completed. Waiting for citizenship ceremony","Citizenship application is In progress since February 3rd 2026. Location: Ottawa. Last update on tracker was for Language, Prohibition and Physical presence completed. Waiting for citizenship ceremony",https://reddit.com/r/CanadaVisa/comments/1sezioy/citizenship_application_is_in_progress_since/,0.5,2,CanadaVisa,0,0,0afd125aa30c2e711b446a32778606a6
reddit_USCIS,2026-06-16,usa,general,q_and_a,H1b Pending (Regular Processing) to new H1b employer? Can a new employer file an H-1B transfer while my current H-1B transfer is still pending?,H1b Pending (Regular Processing) to new H1b employer? Can a new employer file an H-1B transfer while my current H-1B transfer is still pending?,https://reddit.com/r/USCIS/comments/1u6xe4k/h1b_pending_regular_processing_to_new_h1b/,0.5,2,USCIS,0,0,75b78965d7669d363d2c8aa65d4bf9cc
reddit_USCIS,2026-06-16,usa,general,q_and_a,"Texas DL Renewal Delayed — SAVE Says “Case Returned to Agency"", but DPS site showing waiting for a response from USCIS, What Does This Mean?","Texas DL Renewal Delayed — SAVE Says “Case Returned to Agency"", but DPS site showing waiting for a response from USCIS, What Does This Mean?",https://reddit.com/r/USCIS/comments/1u6v3n0/texas_dl_renewal_delayed_save_says_case_returned/,0.5,2,USCIS,0,0,64f8cd4ffd127d8d7bf56281ee72cf2d
reddit_USCIS,2026-06-16,usa,general,q_and_a,"Maiden Name Passport, Married Name Green Card, No Marriage Certificate - Anyone Had Issues Returning to the US?","Maiden Name Passport, Married Name Green Card, No Marriage Certificate - Anyone Had Issues Returning to the US?",https://reddit.com/r/USCIS/comments/1u6uv6n/maiden_name_passport_married_name_green_card_no/,0.5,2,USCIS,0,0,bd030763b2a6ca25f485d7afd2ab4df2
reddit_USCIS,2026-06-16,usa,general,q_and_a,"How long does USCIS take to charge the $1,440 filing fee (G-1450) after FedEx delivers an I-485 packet?","How long does USCIS take to charge the $1,440 filing fee (G-1450) after FedEx delivers an I-485 packet?",https://reddit.com/r/USCIS/comments/1u6p6a2/how_long_does_uscis_take_to_charge_the_1440/,0.5,2,USCIS,0,0,853752a6788ecc8f4d3956dad58b2a76
reddit_USCIS,2026-06-16,usa,general,q_and_a,I-130 question re: information about beneficiary in their native written language and foreign address,I-130 question re: information about beneficiary in their native written language and foreign address,https://reddit.com/r/USCIS/comments/1u6p5bi/i130_question_re_information_about_beneficiary_in/,0.5,2,USCIS,0,0,a7f09dfd39d1941b9d51ab170ce8b126
reddit_USCIS,2026-06-16,usa,general,q_and_a,"“A decision cannot be made” because officer wants to go through my tax papers again to confirm I don’t owe $. My husband had his interview the same time and his was approved. We file jointly, always o","“A decision cannot be made” because officer wants to go through my tax papers again to confirm I don’t owe $. My husband had his interview the same time and his was approved. We file jointly, always o",https://reddit.com/r/USCIS/comments/1u6n3bi/a_decision_cannot_be_made_because_officer_wants/,0.5,2,USCIS,0,0,d3182199502067fbff58a35abe37b5a5
reddit_USCIS,2026-06-16,usa,general,q_and_a,"Former DHS/USCIS Asylum Officer and ICE OCC law clerk, now in private immigration practice. AMA — asylum, RFEs/denials, high-skill visas and green cards, H-1B alternatives, complicated histories, and ","Former DHS/USCIS Asylum Officer and ICE OCC law clerk, now in private immigration practice. AMA — asylum, RFEs/denials, high-skill visas and green cards, H-1B alternatives, complicated histories, and ",https://reddit.com/r/USCIS/comments/1u6lmzl/former_dhsuscis_asylum_officer_and_ice_occ_law/,0.5,2,USCIS,0,0,8c3487ea1b9e7caa5c62f62e20f6354d
reddit_immigration,2026-06-16,usa,general,q_and_a,"Maiden Name Passport, Married Name Green Card, No Marriage Certificate - Anyone Had Issues Returning to the US?","Maiden Name Passport, Married Name Green Card, No Marriage Certificate - Anyone Had Issues Returning to the US?",https://reddit.com/r/immigration/comments/1u6utxs/maiden_name_passport_married_name_green_card_no/,0.5,2,immigration,0,0,47952301c5e81aad48ebda6d4075d114
reddit_immigration,2026-06-16,usa,general,q_and_a,"Anyone who have stayed 6months in the US as tourist B2 visa, were you able to go back to the US from your home country after 10months or a year?","Anyone who have stayed 6months in the US as tourist B2 visa, were you able to go back to the US from your home country after 10months or a year?",https://reddit.com/r/immigration/comments/1u5o947/anyone_who_have_stayed_6months_in_the_us_as/,0.5,2,immigration,0,0,87a1d51557f8cf186d84baa58b9a015c
reddit_immigration,2026-06-16,usa,general,q_and_a,So my wife's oath ceremony has been scheduled at an address in the middle of the woods...has this happened to anyone else?,So my wife's oath ceremony has been scheduled at an address in the middle of the woods...has this happened to anyone else?,https://reddit.com/r/immigration/comments/1u32o8p/so_my_wifes_oath_ceremony_has_been_scheduled_at/,0.5,2,immigration,0,0,fdea9346cccc48e550fa2a9f7bd7d925
reddit_immigration,2026-06-16,usa,general,q_and_a,At what point does a refugee crisis become so large that existing asylum laws stop being practically enforceable?,At what point does a refugee crisis become so large that existing asylum laws stop being practically enforceable?,https://reddit.com/r/immigration/comments/1u2vsw5/at_what_point_does_a_refugee_crisis_become_so/,0.5,2,immigration,0,0,f5e154b84251a969eb8f4f36162d09d2
reddit_immigration,2026-06-16,usa,general,q_and_a,How can I get work visa for new employees for my company? My company wants to hire workers from other country,How can I get work visa for new employees for my company? My company wants to hire workers from other country,https://reddit.com/r/immigration/comments/1u2kjs5/how_can_i_get_work_visa_for_new_employees_for_my/,0.5,2,immigration,0,0,72678d7823837da3066a54f8e18ad655
reddit_immigration,2026-06-16,usa,general,q_and_a,Trump administration launches largest-ever effort to denaturalize U.S. citizens accused of fraud or other crimes,Trump administration launches largest-ever effort to denaturalize U.S. citizens accused of fraud or other crimes,https://reddit.com/r/immigration/comments/1u2clkl/trump_administration_launches_largestever_effort/,0.5,2,immigration,0,0,a0e3dc0509c4023c6dc4e61b9f54988d
reddit_CanadaVisa,2026-06-16,canada,general,q_and_a,"IRCC Non-Compliant Employers - May 2026 Update: 24 new employers added, $14.7M in total fines.","IRCC Non-Compliant Employers - May 2026 Update: 24 new employers added, $14.7M in total fines.  Hello everyone...As promised, back with the monthly update as of May end. April ended at 1,318...the lis",https://reddit.com/r/CanadaVisa/comments/1tptzal/ircc_noncompliant_employers_may_2026_update_24/,0.5,2,CanadaVisa,0,0,3f72d61cc63c58c4053979c3e6fbccd3
reddit_CanadaVisa,2026-06-16,canada,general,q_and_a,Need help on submitting P1,Need help on submitting P1  Hello I am outside canada and received my p1 . I do not have trv as well to come back to reply for p1 . What should i do . This is inland application.,https://reddit.com/r/CanadaVisa/comments/1tpbv29/need_help_on_submitting_p1/,0.5,2,CanadaVisa,0,0,4352bef71bf99bdfa0b686925d41d588
reddit_CanadaVisa,2026-06-16,canada,general,q_and_a,Has anyone tried applying for multi-entry visa after getting supervisa?,Has anyone tried applying for multi-entry visa after getting supervisa?  My mom has visited me using supervisa 2 years ago. She wants to visit me again with her friends (on multi-entry visitor visa) t,https://reddit.com/r/CanadaVisa/comments/1tmsq43/has_anyone_tried_applying_for_multientry_visa/,0.5,2,CanadaVisa,1,0,30fa2b6902e8d54e0686b5e11a901640
reddit_CanadaVisa,2026-06-16,canada,general,q_and_a,Passport request letter addressed to old name,"Passport request letter addressed to old name  My mother-in-law previously held a Canada visitor visa which was expiring, so she reapplied for a new visitor visa.  Since her last visa, she legally cha",https://reddit.com/r/CanadaVisa/comments/1tm0j6x/passport_request_letter_addressed_to_old_name/,0.5,2,CanadaVisa,0,0,d663b46d9422b7a4644c020ee0db5ed7
reddit_CanadaVisa,2026-06-16,canada,general,q_and_a,Visitor Visa approved but passport renewed during the process,Visitor Visa approved but passport renewed during the process  My visitor visa (trv inside canada) application took so long so I renewed my passport during the process.  I recently received my PPR my ,https://reddit.com/r/CanadaVisa/comments/1tlud3k/visitor_visa_approved_but_passport_renewed_during/,0.5,2,CanadaVisa,0,0,9b5a96816a2bcf1bc8adf9d3043afbc3
reddit_CanadaVisa,2026-06-16,canada,general,q_and_a,TRAVEL OUTSIDE CANADA,"TRAVEL OUTSIDE CANADA  Hi all,  I need advice regarding my case. My application is for common-law inland sponsorship in Canada (outside Quebec). My application has been stuck in the background check s",https://reddit.com/r/CanadaVisa/comments/1tkym3h/travel_outside_canada/,0.5,2,CanadaVisa,0,0,8cef19c9cb4615805399ec0c1fc7dd31
reddit_CanadaVisa,2026-06-16,canada,general,q_and_a,Parents Visitor Visa Refusal,Parents Visitor Visa Refusal  Hi guys Need your advice I am PR work part time & preparing for licensing exam. I applied for my parents visitor (India)visa last year Sep which got refused. Same reason ,https://reddit.com/r/CanadaVisa/comments/1tkpubl/parents_visitor_visa_refusal/,0.5,2,CanadaVisa,1,0,1457481a5e1f2571fd254b334259bc80
reddit_CanadaVisa,2026-06-16,canada,general,q_and_a,Soft Landing Plan,"Soft Landing Plan  Hey everyone,  I recently got my Canadian eCorp for Ontario and I’m planning to do a soft landing soon. My plan is:  \- Land in Montreal and complete my PR landing  \- Stay about on",https://reddit.com/r/CanadaVisa/comments/1tkbulk/soft_landing_plan/,0.5,2,CanadaVisa,0,0,65d666015eec1fd520eedbeadda17ea4
reddit_CanadaVisa,2026-06-16,canada,general,q_and_a,Visa for adult children?,"Visa for adult children?  Hello, I have a very specific situation I’m hoping someone can point me in the right direction. I‘m 42 and my spouse is 44. We’re American. My stepfather is a Canadian citize",https://reddit.com/r/CanadaVisa/comments/1t7ovfx/visa_for_adult_children/,0.5,2,CanadaVisa,3,0,2d564b62210dccb5d6db5d539263a1fc
reddit_CanadaVisa,2026-06-16,canada,general,q_and_a,Applying for a Canadian visitor visa after a one-year exclusion order — need advice,"Applying for a Canadian visitor visa after a one-year exclusion order — need advice  Hello everyone,  I would like to ask for advice from people who may have gone through a similar situation, or from ",https://reddit.com/r/CanadaVisa/comments/1t66h30/applying_for_a_canadian_visitor_visa_after_a/,0.5,2,CanadaVisa,2,0,e261e7dbb1cc2e0825b957e0557e9aca
reddit_CanadaVisa,2026-06-16,canada,general,q_and_a,Name split on passport – traveling with old & new passport + work permit (Canada),"Name split on passport – traveling with old & new passport + work permit (Canada)  I recently had my name split on my Indian passport through BLS International in Canada. Like many of us, my passport ",https://reddit.com/r/CanadaVisa/comments/1sx2s26/name_split_on_passport_traveling_with_old_new/,0.5,2,CanadaVisa,2,0,fed72dd1884dd4bbe0f2c73bffb37950
reddit_CanadaVisa,2026-06-16,canada,general,q_and_a,ICT Work Permit under GSS — Anyone approved in 2 weeks lately?,ICT Work Permit under GSS — Anyone approved in 2 weeks lately?  My employer recently submitted an Intra-Company Transfer (ICT) application(LMIA exempt) from US under the Global Skills Strategy (GSS). ,https://reddit.com/r/CanadaVisa/comments/1svpjou/ict_work_permit_under_gss_anyone_approved_in_2/,0.5,2,CanadaVisa,3,0,9229e14411d06cd9c45d4b7e801b7c08
reddit_CanadaVisa,2026-06-16,canada,general,q_and_a,"Super Visa delay (280+ days) – one parent approved, other stuck.","Super Visa delay (280+ days) – one parent approved, other stuck.  Hi everyone,  Looking for advice or similar experiences.  I applied for Super Visa for both my parents around the same time. My father",https://reddit.com/r/CanadaVisa/comments/1sq2eq2/super_visa_delay_280_days_one_parent_approved/,0.5,2,CanadaVisa,2,0,05b00a956b8a2352ce7dd442009325d0
